{
  "schema_version": "1.2",
  "generated_at": "2026-09-07T18:50:00+08:00",
  "acceptance_unit_id": "AU-post-grad-cat-splitwithsizes-replace",
  "upstream_commit": "8e86e0a23e3679c2bf3406cf0837fcb6297a5d9b",
  "reference": {
    "run_id": "reference-20260906T212121+0800-898omha0",
    "suite_status": "valid-reference-suite",
    "suite_valid": true,
    "environment_fingerprint": "ad8df1e2357e5e0351014dc7c3dd578f8ae640b4726d1138bc991cc30da10dc3",
    "payload_sha256": "dba65b563da64991f556e2b93658b0996dae266fd207e8a93fe4fc6becc024e7",
    "cases": [
      {
        "case_id": "REF-cat-splitwithsizes-native",
        "case_status": "passed",
        "reference_valid": true,
        "reference_result_sha256": "5964494b8156aeaabf0ce145c623ce837d508b8f1ad1383ee553543cdbcde237",
        "artifact_inventory_sha256": "6f175f8a6d6a0ad2a3808a972273ca20057e4a3614b353c636675576ec6f472a"
      }
    ]
  },
  "npu": {
    "result_path": "results/current/AU-post-grad-cat-splitwithsizes-replace/npu_result.json",
    "result_sha256": "77b365ece050ac0094ccc7ff5e62e2573385d5c54d75dfee475e83853fd564be",
    "environment_fingerprint": "5bddbfd035192005a1911ddd336364b9f0cecb9074376642980bbde87f104a80",
    "tracking_mode": "adapter",
    "execution_success": true,
    "correctness_status": "passed"
  },
  "variant_comparisons": [
    {
      "variant_id": "same-boundaries-positive",
      "intent": "split sizes 与各 cat 输入边界一致，消除 cat/split",
      "source_locations": [
        {
          "path": "torch/_inductor/fx_passes/post_grad.py",
          "line": 1786,
          "symbol": "cat_splitwithsizes_replace"
        }
      ],
      "gpu_behavior": "冻结 A100 reference 按社区 expectation 命中并通过。",
      "npu_behavior": "Ascend910B2 与社区正负例 expectation 一致，数值和结构断言通过。",
      "reference_contract_stable": true,
      "reference_target_match": true,
      "npu_target_match": true,
      "match_contract_aligned": true,
      "runtime_path": "triton",
      "correctness_status": "passed",
      "performance_status": "passed",
      "comparison_basis": "equivalent-contract",
      "verdict": "BEHAVIOR_UNCHANGED",
      "note": "功能合同一致；正例另有目标级性能收益证据。"
    },
    {
      "variant_id": "cat-multi-user-negative",
      "intent": "cat 还有其他用户时不得消除",
      "source_locations": [
        {
          "path": "torch/_inductor/fx_passes/post_grad.py",
          "line": 1786,
          "symbol": "cat_splitwithsizes_replace"
        }
      ],
      "gpu_behavior": "冻结 A100 reference 按社区 guard 不命中并通过。",
      "npu_behavior": "Ascend910B2 与社区正负例 expectation 一致，数值和结构断言通过。",
      "reference_contract_stable": true,
      "reference_target_match": false,
      "npu_target_match": false,
      "match_contract_aligned": true,
      "runtime_path": "triton",
      "correctness_status": "passed",
      "performance_status": "passed",
      "comparison_basis": "equivalent-contract",
      "verdict": "BEHAVIOR_UNCHANGED",
      "note": "功能合同一致；正例另有目标级性能收益证据。"
    },
    {
      "variant_id": "different-split-dim-negative",
      "intent": "cat 与 split 维度不同，不得消除",
      "source_locations": [
        {
          "path": "torch/_inductor/fx_passes/post_grad.py",
          "line": 1786,
          "symbol": "cat_splitwithsizes_replace"
        }
      ],
      "gpu_behavior": "冻结 A100 reference 按社区 guard 不命中并通过。",
      "npu_behavior": "Ascend910B2 与社区正负例 expectation 一致，数值和结构断言通过。",
      "reference_contract_stable": true,
      "reference_target_match": false,
      "npu_target_match": false,
      "match_contract_aligned": true,
      "runtime_path": "triton",
      "correctness_status": "passed",
      "performance_status": "passed",
      "comparison_basis": "equivalent-contract",
      "verdict": "BEHAVIOR_UNCHANGED",
      "note": "功能合同一致；正例另有目标级性能收益证据。"
    },
    {
      "variant_id": "different-split-count-negative",
      "intent": "split 数量与 cat 输入数量不同，不得消除",
      "source_locations": [
        {
          "path": "torch/_inductor/fx_passes/post_grad.py",
          "line": 1786,
          "symbol": "cat_splitwithsizes_replace"
        }
      ],
      "gpu_behavior": "冻结 A100 reference 按社区 guard 不命中并通过。",
      "npu_behavior": "Ascend910B2 与社区正负例 expectation 一致，数值和结构断言通过。",
      "reference_contract_stable": true,
      "reference_target_match": false,
      "npu_target_match": false,
      "match_contract_aligned": true,
      "runtime_path": "triton",
      "correctness_status": "passed",
      "performance_status": "passed",
      "comparison_basis": "equivalent-contract",
      "verdict": "BEHAVIOR_UNCHANGED",
      "note": "功能合同一致；正例另有目标级性能收益证据。"
    },
    {
      "variant_id": "different-boundaries-negative",
      "intent": "split 边界与 cat 输入大小不一致，不得消除",
      "source_locations": [
        {
          "path": "torch/_inductor/fx_passes/post_grad.py",
          "line": 1786,
          "symbol": "cat_splitwithsizes_replace"
        }
      ],
      "gpu_behavior": "冻结 A100 reference 按社区 guard 不命中并通过。",
      "npu_behavior": "Ascend910B2 与社区正负例 expectation 一致，数值和结构断言通过。",
      "reference_contract_stable": true,
      "reference_target_match": false,
      "npu_target_match": false,
      "match_contract_aligned": true,
      "runtime_path": "triton",
      "correctness_status": "passed",
      "performance_status": "passed",
      "comparison_basis": "equivalent-contract",
      "verdict": "BEHAVIOR_UNCHANGED",
      "note": "功能合同一致；正例另有目标级性能收益证据。"
    }
  ],
  "first_divergence": "none",
  "root_cause": "GPU/NPU 功能行为一致，NPU 目标级性能测量显示收益。",
  "recommended_action": "保留启用并持续运行正负例及性能回归。",
  "final_verdict": "PERF_IMPROVED",
  "repair_status": "not-needed"
}
